{
  "$schema": "argus/runner-result@1",
  "schemaVersion": 1,
  "mode": "full-suite",
  "status": "pass",
  "exitCode": 0,
  "generatedAt": "2026-07-10T10:05:00Z",
  "deliveryGate": true,
  "missingExpectedBugs": 0,
  "categories": {
    "product": 1,
    "automation": 0,
    "infrastructure": 0,
    "skip": 1,
    "policy": 0
  },
  "events": [
    {
      "caseId": "api:orders.spec.ts:creates-a-charged-order",
      "category": "product",
      "status": "pass",
      "expected": false,
      "lifecycle": "n/a",
      "bugId": null,
      "reason": "passed"
    },
    {
      "caseId": "ui:checkout.spec.ts:webkit-checkout",
      "category": "skip",
      "status": "skipped",
      "expected": false,
      "lifecycle": "n/a",
      "bugId": null,
      "reason": "browser-not-in-scope"
    }
  ]
}
