{
  "$schema": "argus/runner-result@1",
  "schemaVersion": 1,
  "mode": "full-suite",
  "status": "pass",
  "exitCode": 0,
  "generatedAt": "2026-09-03T18:00:00Z",
  "deliveryGate": true,
  "missingExpectedBugs": 0,
  "categories": {
    "product": 1,
    "automation": 1,
    "infrastructure": 0,
    "skip": 0,
    "policy": 0
  },
  "events": [
    {
      "caseId": "api.health",
      "category": "product",
      "status": "pass",
      "expected": false,
      "lifecycle": "n/a",
      "bugId": null,
      "reason": "suite-passed"
    },
    {
      "caseId": "regression.0001",
      "category": "automation",
      "status": "pass",
      "expected": false,
      "lifecycle": "automated",
      "bugId": "BUG-0001",
      "reason": "test-passed"
    }
  ]
}
